PRODUCT NAME,COMMENT,Website name,Label,sentiment
BLUSH,repurchased blush . cant beat colour winter kissed price affordable . high quality colour last day,influenster,Positive,1
BLUSH,"pigmented hot pink ! packaging delicate , randomly broke bag tweak look weird colour beautiful ! sure make sense blush feel powdery . hard work beginner ! took time managed work .",influenster,Positive,1
BLUSH,highly recommend getting blush like light color blend skin tone also super luscious make look flawless .,influenster,Positive,1
BLUSH,"work nicely ! complaint much build maybe 's shade skin , product tried kylie make want ! recommend",influenster,Positive,1
BLUSH,"love blush , 's super pigmented long lasting . 's blend like dream texture creamy matte finish . 's fragrance packaging super cute 'm baby pink .",influenster,Positive,1
BLUSH,love blush kylie ! go flawless little bit go long way . theres scent love . packaging great . simple yet flawless .,influenster,Positive,1
BLUSH,wanted try blush happy colour natural looked . loved easy blend didnt clog pore .,influenster,Positive,1
BLUSH,"kylie cosmetic blush winter kissed awesome . give nice , rosy glow look like youve come cold . formula super smooth blend easily .",influenster,Positive,1
BLUSH,really love kylie blush ! use shade winter kissed . pink packaging cute . its easy apply stay . definitely want try shade & cream blush !,influenster,Positive,1
BLUSH,love product ! ! its super pigmented . packaging cute pink . great go traveling . last hour doesnt break easily,influenster,Positive,1
BLUSH,"kylie cosmetic blush well-regarded product known highly pigmented formula smooth texture.available variety shade , blush provides matte-velvet finish suitable different skin tone .",influenster,Positive,0
BLUSH,"product really nice cool toned pink blush ! its powdery sits skin nicely . scent , packaging bad writing front came almost instantly",influenster,Positive,1
BLUSH,"kylie cosmetic blush impress strong pigmentation seamless blendability . texture silky smooth , minimalist packaging chic . 's faint , pleasant scent . highly recommend !",influenster,Positive,1
BLUSH,product really nice cool toned pink blush ! its powdery sits skin nicely .,influenster,Positive,1
BLUSH,"kylie cosmetic blush impress strong pigmentation seamless blendability . texture silky smooth , minimalist packaging chic . 's faint , pleasant scent . highly recommend !",influenster,Positive,1
BLUSH,brand never disappointed ever . pigmentation particular shade make go everyday ! love packaging ! ! blend second 's perfect texture .,influenster,Positive,1
BLUSH,pigmentated face leave color looking . take blending due highly pigmentation . packaging beautiful worth money .,influenster,Positive,1
BLUSH,love using blush . texture good blend well . colour lovely skin . isnt flaky doesnt go everywhere . use bigger brush apply .,influenster,Positive,1
BLUSH,love kylie blush theyre beautiful easy blend pigment really scent texture soft . love . worth every penny,influenster,Positive,1
BLUSH,"shade pink power ' really like its heavy pink . its natural shade . im fair complected show nicely , even though its pretty light . ordered directly kylie cosmetic website , sight unseen .",influenster,Positive,1
BLUSH,pigmentation blush refine blend right skin texture soft finish well perfect packaging travel size .. would recommend,influenster,Positive,1
BLUSH,'m obsessed kylie cosmetic blush shade 336 ! color cute - gorgeous soft pink give cheek natural-looking flush .,influenster,Positive,1
BLUSH,blush favorite since released . perfect blush topper & transition blush ! help blend blush concealer beautifully !,influenster,Positive,1
BLUSH,shade winter kissed love . pigmented point much . build however want . packaging cute .,influenster,Positive,1
BLUSH,one favorite blush ! use shade winter kissed always look perfect matter look . little go long way overall product exactly everyone want blush !,influenster,Positive,1
BLUSH,"dont think pigmented would liked . pigmentation its great ; however , think keep reapplying last whole day .",influenster,Positive,1
BLUSH,"best blush ever ! last day its perfect shade looking ? youre looking super light blush blend perfectly bronzer , !",influenster,Positive,1
BLUSH,blush great amount pigment . blend prefectly skin without leaving looking dry . beautiful finsh amazing packaging .,influenster,Positive,1
BLUSH,love blush good pigmentation blend nicely good texture finish matte packaging cute cause pink would recommend,influenster,Positive,1
BLUSH,"beautiful blush , its pigmented , last long time packaging nice make skin look glowy look cute using one long time",influenster,Positive,1
BLUSH,pretty natural blush . its pigmented its easy blend always build . wish staying power packaging feel cheap .,influenster,Positive,1
BLUSH,"love packaging , cute ! color blush great well . price pretty reasonable well . thought color would pink looking , great fair skin !",influenster,Positive,1
BLUSH,love power blush . packaging cute pigmentation right . blend easily . end looking flawless smooth .,influenster,Positive,1
BLUSH,"oh gosh , wow pigmentation undefeatable . blend ability told friend good texture finishing packaging everything product amazing wow wow wow wow wow",influenster,Positive,1
BLUSH,"pigmentation notable , blend perfectly , texture heavy , finish good , easy wear daily , packaging funny",influenster,Positive,1
BLUSH,"became one favorite blush , go really well cool undertone , good pigmentation",influenster,Positive,1
BLUSH,"kylie cosmetic ' blush highly recommended product want long-lasting natural-looking blush . blush formula highly pigmented , delivering natural-looking flush colour cheek .",influenster,Positive,1
BLUSH,"good pigmentation its easy blend . shade winterkissed cool toned pink , leaning towards purple hue rather orange looking blush .",influenster,Positive,1
BLUSH,"kylie cosmetic blush pretty solid rep ! 's known pigmented color give nice , natural flush cheek . people also say blend smoothly , great 're going subtle look .",influenster,Positive,1
BLUSH,"pink power classic famous , makeup artist rose black pink always use pink power daily makeup . color subtle smooth , packing paper usual , finish look matte always love",influenster,Positive,1
BLUSH,light pink shade its pretty cute u think its meant fair skin tone rather deeper complexion . colour didnt show well,influenster,Positive,1
BLUSH,"got blush many year ago know expensive worth . personally still use . like give beautiful , blushing look .",influenster,Positive,1
BLUSH,"got blush many year ago know expensive worth . personally still use . like give beautiful , blushing look .",influenster,Positive,1
BLUSH,amazing blush ! shade winter shade perfect dry skin ! tends light always making face look much better . its definitely one on-the-go product ! !,influenster,Positive,1
BLUSH,"trying find cool toned blush fungal acne-safe , one well recommended . , `` winterkissed '' purple cool-pink . really disappointing looked chalky sad .",influenster,Positive,1
BLUSH,pigment first round wasnt best newer one give natural blush look love look great dewy foundation .,influenster,Positive,1
BLUSH,"beautiful blush ! nice pigmentation , cute pink packaging , high quality ! matte finish , could blend high intensity ! blurring texture , give skin youth fresh look !",influenster,Positive,1
BLUSH,"un blush super estetico , dalla formulazione top e colorazione perfetta per il mio incarnato . è un prodotto persistente , non svanisce immediatamente , ed è il giusto compromesso fra leffetto naturale e non .",influenster,Positive,1
BLUSH,den här blushen har så mycket pigment att man bara behöver ta blush en gång . älskar alla färgerna och sminket ser helt flawless ut efter . den smälter huden så fint .,influenster,Positive,1
BLUSH,"pigmentation amazing blend really good face , texture amazing finished product always great ! love packaging",influenster,Positive,1
BLUSH,"e un blush fascinantes tiene una pigmentación muy muy buena , textura suave en tu piel tiene un acabado muy muy rosita bebé encanta su empaque e muy original",influenster,Positive,1
BLUSH,product really good loved perfect touch finish look love pigmentation texture fabulous packaging cute good quality blendability good .,influenster,Positive,1
BLUSH,blush good . wished wouldve bought pinky shade . shade got baddie block. think fair price packaging cute !,influenster,Positive,1
BLUSH,"jätte trevlig blush jag köpte den dock för inte så länge sedan så jag har inte riktigt lärt mig arbeta med den . men super fin och trevlig än så länge , den blandar ut fint och har ett super bra pigment .",influenster,Positive,1
BLUSH,like color . n't normally use blush gift . 's subtle color overwhelming awesome . normally stick mascara eyeliner part .,influenster,Positive,1
BLUSH,"love blush ! pigmented , easy blend brush , packaging always pretty kylie , give beautiful finishing look great texture !",influenster,Positive,1
BLUSH,sooo pigmented blend easily matte finish light weight texture also packaging cute pink color blush ? ?,influenster,Positive,1
BLUSH,"pretty pigmented , easy blend . wish satin option , matte pretty decent color selection . also sensitive skin doesnt break .",influenster,Positive,1
BLUSH,"really love blush much ! its look good every type skin . blush pigmented make package last longer . definitely try , favourite blush .",influenster,Positive,1
BLUSH,"blush di kylie cosmetic sono così iconici . winter kissed è assoluto la mia colorazione preferita , un baby pink adorabile , super pigmentato e dalla texture morbida e non troppo polverosa .",influenster,Positive,1
BLUSH,like using blush top powder seems last day . thing dont love chalky kind texture blush .,influenster,Positive,1
BLUSH,blush absolutely gorgeous pigment amazing since used blush used single one give best finish definitely recommend !,influenster,Positive,1
BLUSH,absolutely love everything kylie ! used blush almost two year ! n't bought blush 's good . also love simple pink packaging .,influenster,Positive,1
BLUSH,"honestly , ive tried lot blush . great blush , its new think three month loses pigmentation . get powdery bit . ?",influenster,Positive,1
BLUSH,packaging always simple elegant . kylie blush offered perfect shade stay beautifully . definitely integral part makeup routine,influenster,Positive,1
BLUSH,"kylie blush like beautiful build able color . much recommend product replace current blush.the packaging favorite formula smooth buttery , making super easy blend .",influenster,Positive,1
BLUSH,"jag älskar hur man kan bygga upp den och förpackningen är så tjejig , den är coral färgat vilket jag gillar , kommer absolut köpa om denna blushen ! ! !",influenster,Positive,0
BLUSH,favorite blush date ! ive using 2 year always reach . its barbie pink still soft time .,influenster,Positive,1
BLUSH,pigmentation great its cute packaging its cute color . blendability add order see .,influenster,Positive,1
BLUSH,"love color blush named winter kissed ! 's beautiful blend good leaf cute pink cheek . packaging always cute anything , kylie release ?",influenster,Positive,1
BLUSH,pigmentation good buildable blendable easy work texture good finish depends u apply use packaging easy work,influenster,Positive,1
BLUSH,"love color , looking real pink found",influenster,Positive,1
BLUSH,"blush use midtone blushing ! shade winter kissed , give beautiful finish amplifies cheek area ! packaging cute come little mirror .",influenster,Positive,1
BLUSH,blush shade winter kissed pretty color ! packaging pink happy ! blend like dream finish silky / matte !,influenster,Positive,1
BLUSH,'s beautifull blush perfect winter ( shade winter kissed ) normally n't like powdered blush one actually good !,influenster,Positive,1
BLUSH,love blush . pigmented leaf skin glowing . favourite would highly recommend . love color texture one .,influenster,Positive,1
BLUSH,great product . color vibrant without much . long lasting well . pink packaging make feel pretty well . find blend easily blush brush .,influenster,Positive,1
BLUSH,beautiful packaging . use winter kissed color ! pigmented love use blush topper . easy blend since color light .,influenster,Positive,1
BLUSH,great blush ! shade winterkissed amazing ! lighter side buildable . powder like pair liquid blush !,influenster,Positive,1
BLUSH,"335 : baddy block blush , beautiful peachy shade , good pigmentation blend well . nice matte finish . price reasonable compared brand .",influenster,Positive,1
BLUSH,"2 shade kylie cosmetic blush . im obsessed shade 336 winter kissed , love color texture soft , well pigmented gives smooth & natural glow , easy apply little go long way .",influenster,Positive,1
BLUSH,"pigmentation pretty good , blend easily foundation.i like packaging , 's pink.the finish look always good kyle cosmetic ? ?",influenster,Positive,1
BLUSH,pigmentation nice blend easily . n't noticed fallout . feel like last forever . shade `` baddie block '' `` winter kissed '' . would definitely recommend .,influenster,Positive,1
BLUSH,"affordable , blush soo pigmented go like dream leaving base looking flawless pink finish beautiful",influenster,Positive,1
BLUSH,love kylie packaging nice sister told try let try beautiful . love shade . love scent blending amazing .,influenster,Positive,1
BLUSH,"say , wow , one best highlight going yellow , make makeup look spot highly recommended . tried many brand n't good . yes",influenster,Positive,1
BLUSH,"blush exceeds expectation rich pigmentation , delivering vibrant long-lasting color payoff . finish beautifully radiant , adding healthy glow cheek .",influenster,Positive,1
BLUSH,cute packaging cute pigmentation ... best 's bad either nothing special ... texture pretty good blend easily,influenster,Positive,1
BLUSH,never pinky blush girly till tried ! ! cousin kept trying get try took month . im obsessed ! ! ! its pretty pinky color . bright its perfect shade pink ! ! first wont last kylie cosmetic purchase,influenster,Positive,1
BLUSH,one best blush ! its pigmented & give soft baby pink glow ! finish natural buildable ! packaging also cute pink !,influenster,Positive,1
BLUSH,"beautiful blush ! love sits skin , its blend-able pigment buildable well . skin like finish lay beautifully top product . definitely didnt miss product !",influenster,Positive,1
BLUSH,try sometimes prodoct start appreciate know dose final result cool,influenster,Positive,1
BLUSH,"love pigmentation blush , its easy blend one favorite blush got shade baddie block im obsessed . ?",influenster,Positive,1
BLUSH,"lovvvvvve blush , texture , finish , blendability ! ! ! honestly its unreal . would recommend everyone . pigmentation good",influenster,Positive,1
BLUSH,loveee its pigmented look great . theres definitely better blush price its cutest packaging dont even care tbh,influenster,Positive,1
BLUSH,"im blush girly id say pretty good critique , blend beautiful blush look pretty skin tone . texture smooth powdery color pretty .",influenster,Positive,1
BLUSH,pigment great blend nicely . literally going buy another next day im almost . packaging beautiful finish leaf face looking flawless .,influenster,Positive,1
BLUSH,first time trying kylies blush its amazing ! its smooth,influenster,Positive,1
BLUSH,broke re-pat great blush . pigmented beautiful color . used favorite blush use one new one .,influenster,Positive,1
BLUSH,"pigmented beautiful colour , perfect winter blush look . lasted long time even use daily . would definitely recommend looking new favourite blush last long time .",influenster,Positive,1
BLUSH,"favorite time . incredible pigmentation finish . highly recommend . cute packaging , easy blend . favorite .",influenster,Positive,1
BLUSH,sorry bit messy looking used kylie cosmetic blush lol like much ! nice colour choose favourite,influenster,Positive,1
BLUSH,pigmented last awhile . blend really well eye shade . its really pretty shade nice look really well cheek .,influenster,Positive,1
BLUSH,"shocked liked blush much . color beautiful , pigmented . blush careful put much theyre almost pigmented , one opposite problem anything .",influenster,Positive,1
BLUSH,lightweight dont feel skin pigmentation buildable blend really easy blendability isnt something worry abt come packaging freaking cute ?,influenster,Positive,1
BLUSH,'ve seen many complaint blush pigmented 've problem pigmentation . absolutely love light pink colour add,influenster,Positive,1
BLUSH,"color pretty , doesnt show large pore , stay pretty good long time like 7hours skin . package cute thin , its easy carry bag .",influenster,Positive,1
BLUSH,oh well budget.as product much expensive.butonce gathered courage buy product world.they amazing.gives fast results.good skin .,influenster,Positive,1
BLUSH,"kylie cosmetic known high-quality product , pink blush exception . color beautiful give nice rosy tone cheek . easy apply give natural , fresh look .",influenster,Positive,1
BLUSH,absolutely love kylie cosmetic blush ! blend easily stay throughout day ! color amazing ! highly recommend purchasing ! !,influenster,Positive,1
BLUSH,"love blush , color cute blend pretty good . love light pink blush . doesnt separate , cute packaging name ? would buy .",influenster,Positive,1
BLUSH,"beautiful , packaging cute colour . blendability pigmentarion good finish . dont notice scent",influenster,Positive,1
BLUSH,love amazing pigmentation blend easy nice sleek packaging great matte finish highly recommend anything kylie brand .,influenster,Positive,1
BLUSH,ive blush year never stop talking ! come really cute packaging little smell great allergy lol . beautiful finish cheek always look rosy !,influenster,Positive,1
BLUSH,pigmentation product buildable blend easily leaving nice pink check . scent blush although dont think blush scent . packaging basic its pink its cute,influenster,Positive,1
BLUSH,color winter kissed think its beautiful shade work great fair skin . feel like doesnt look smooth still constantly reach . scent . good pigmentation its jaw dropping blush .,influenster,Positive,1
BLUSH,"its really nice blush lot pigment , blend nicely . thing would say difficult open reaspn . like .",influenster,Positive,1
BLUSH,"one favorite collection , specially baddie block . blend really good leaf looking perfectly sunkissed , packaging cutest everyone ask youre using .",influenster,Positive,1
BLUSH,"product great coral color stunning go every look . blend amazing way , scent really come . def recommend .",influenster,Positive,1
BLUSH,"pigment amazing . its easily blended . theres scent packaging good since mirror , blush dont . pink tho , would build liking instead going . overall good product .",influenster,Positive,1
BLUSH,"could pigmented love colour easily layer colour result , blend well leaf matte finish . like use cream tint blush lock colour",influenster,Positive,1
BLUSH,"first impression got blush 's really rosy , reminiscent tiny baby piglet ? , soft rosy-cheeked . 's bit powder fallout blush brush pick , 's big issue .",influenster,Positive,1
BLUSH,"loved soft touch color , packaged great ( similar colourpop ) good smell lasted day easily blendable ! love hate ; made great makeup line first . rebranding changed wasnt .",influenster,Positive,1
BLUSH,"beautiful blush im usually skeptic blush one , its super pigmented easy blend makeup . doesnt weird smell also good .",influenster,Positive,1
BLUSH,"love use blush every day , one great ! perfect pigmentation blend super easily skin . packaging great , price worth !",influenster,Positive,1
BLUSH,"recently got say blush beautiful colour , easy apply n't need much",influenster,Positive,1
BLUSH,"perfect peach blush , natural top . last day long even sweating .",influenster,Positive,1
BLUSH,"eh , didnt love . scent strong , pigmented , didnt blend well overall finish made appear cold . packaging cute , sat makeup desk .",influenster,Positive,1
BLUSH,pigmented ! used daily little go long way ! love sat top makeup . packaging isnt bulky fit well makeup bag,influenster,Positive,1
BLUSH,"got blush shade 334 ( pink power ) absolutely perfect . blend easily im using , like use blend lighten darker blush natural look .",influenster,Positive,1
BLUSH,"essential add perfect flush color cheek silky , blendable texture . long-lasting , vibrant pigment effortlessly enhance complexion , making go-to choice radiant , healthy-looking glow .",influenster,Positive,1
BLUSH,blush add nice touch make look ! like use top darker blush give bit dimension look even give prettiest pink natural flush look great pale skin .,influenster,Positive,1
BLUSH,love kylie blush much ! small amount look natural pale skin noticable little added top . blend easily cause issue liquid product underneath . definitly recommend !,influenster,Positive,1
BLUSH,"nice hood pigment , good shade range love product would recommend . blend nicely worth money . nice packaging buy ..",influenster,Positive,1
BLUSH,really like blush its soft peach color . its pigmented actually enjoy really build color intensity prefer . find really pigmented blush look like clown really quick .,influenster,Positive,1
BLUSH,love blush ! reminds candy cloud faced blush affordable . : ) love packaging girly ! ! pigmentation good .,influenster,Positive,1
BLUSH,packaging nice pigmentation isnt . its nice pretty color theres pigment plus theres lot fallout . theres really scent finish good use lot .,influenster,Positive,1
BLUSH,give really nice airbrushed effect . new bronzers good .,influenster,Positive,1
BLUSH,love color range love pigmented . ? blend really well . packaging cute . love product leave finish face .,influenster,Positive,1
BLUSH,kylies makeup amazing love blush applies nicely great pigment lasted 2 shade theyre still full product use often : ),influenster,Positive,1
BLUSH,blush cute . love good powdered blush . dont use many liquid product . love color pixation color . beautiful,influenster,Positive,1
BLUSH,perfect blush cold make-up look . pigment good guess color also pretty . think better one bad,influenster,Positive,1
BLUSH,blush truly life . pigmented blend well . shade winter kissed skin white give beautiful rosy effect . like queen kylie ?,influenster,Positive,1
BLUSH,bought shade winterkissed its perfect shade cool pink looking . its pigmented would liked still beautiful .,influenster,Positive,1
BLUSH,go amazingly patchy pigmented mine shade winter kiss beautiful pink colour colour theory exist,influenster,Positive,1
BLUSH,"definitely buy , skin type pale look beautiful .",influenster,Positive,1
BLUSH,"need solid blush , job . shade matte pink color payoff good little fallout . overall good choice blush .",influenster,Positive,1
BLUSH,pigment kylies blush crazy . good color doesnt look weird skin . give subtle look face 10/10,influenster,Positive,1
BLUSH,kyle cosmetic blush great pigmented pink . mom blush one wear time . its full coverage dont apply lot .,influenster,Positive,1
BLUSH,"powder blush come cute pink compact several beautiful shade . purchased blush winter kissed obsessed . its beautiful cool toned light pink shade , perfect light skin tone . build coverage",influenster,Positive,1
BLUSH,great blush . pigmented . blend well theres variety shade choose . one favorite brand come blush . would recommend .,influenster,Positive,1
BLUSH,product good love blush color its really vibrant really cute loveee product im repurchasing absolute favorite,influenster,Positive,1
BLUSH,"blush holy grail ? its pigmented literally glide skin like butter . lost makeup bag , one product would 100 % repurchase !",influenster,Positive,1
BLUSH,"dont like many product blush good . 100 % recommend , its super pigmented little go long way super blend able . ive also using blush month almost every day theres dent .",influenster,Positive,1
BLUSH,kylie cosmetic blush stunning pigmentation lush really biggest fan powder blush one one best ive tried its benefit one,influenster,Positive,1
BLUSH,"use blush everyday ! ! its give nice little sun kissed look ! ! shade baddie block its peachy pinky , love much ! !",influenster,Positive,1
BLUSH,pigmented hardly use ! last forever use almost everyday . color gorgeous formula talc free .,influenster,Positive,1
BLUSH,love dont put much noticeable ! price point also reasonable compared high quality makeup brand !,influenster,Positive,1
BLUSH,"think color compliment well last day long . also , cute packaging one suitable skin type . its super easy work doesnt dry separate , give natural matte finish .",influenster,Positive,1
BLUSH,bought blush thinking would really pigmented tried applying didnt come good thought would . maybe skin tone shade im sure .,influenster,Positive,1
BLUSH,favourite blush shade its incredible cool toned amazing winter . 3 would repurchase run . definitely recommend product,influenster,Positive,1
BLUSH,stunning blush ! blush perfect every day wear super easy build . product last age ! absolutely loved blush every time used !,influenster,Positive,1
BLUSH,'m huge blush fan hardly ever look right product black girl friendly ! absolutely love look skin n't add lot show . highly recommend,influenster,Positive,1
BLUSH,"blush pretty color excited except put like 4 coat wasnt pigmented much fallout ! bummed , say though 4 coat looked really pretty !",influenster,Positive,1
BLUSH,"its lovely pink glitter like highlighter , used placed cheek corner eye , inlove",influenster,Positive,1
BLUSH,love collecting blush ! ! trust one perfect . word describe good . love much ! ! ! look cute .,influenster,Positive,1
